{
  "schema_version": "1.0.0",
  "matrix_id": "interim-public-product-route-matrix.v1",
  "interim": true,
  "limitation_status": "external_product_evidence_pending",
  "coverage_dimensions": ["solar_angle_difference_deg", "gsd_ratio", "relief", "overlap_fraction"],
  "routes": [
    {"route_id":"c2-ohrc","mission":"Chandrayaan-2","payload_family":"OHRC","product_id":{"value":null,"reason":"Official product selection pending."},"source_url":{"value":null,"reason":"Verified source record pending."},"access":{"value":null,"reason":"Access conditions pending."},"credentials":{"value":null,"reason":"Credential requirement is unknown; no secret is stored."},"license":{"value":null,"reason":"Licence record pending."},"files_and_references":{"bytes":{"value":null,"reason":"No product acquired."},"sha256":{"value":null,"reason":"No product bytes acquired."},"label":{"value":null,"reason":"No label acquired."},"kernel":{"value":null,"reason":"Kernel inventory pending."},"calibration":{"value":null,"reason":"Calibration reference pending."},"reference_version":{"value":null,"reason":"Reference selection pending."}},"coverage":{"solar_angle_difference_deg":{"value":null,"reason":"Geometry unverified."},"gsd_ratio":{"value":null,"reason":"Pair unselected."},"relief":{"value":null,"reason":"Terrain unselected."},"overlap_fraction":{"value":null,"reason":"Footprints unavailable."}},"status":"external_evidence_pending"},
    {"route_id":"c2-tmc-2","mission":"Chandrayaan-2","payload_family":"TMC-2","product_id":{"value":null,"reason":"Official product selection pending."},"source_url":{"value":null,"reason":"Verified source record pending."},"access":{"value":null,"reason":"Access conditions pending."},"credentials":{"value":null,"reason":"Credential requirement is unknown; no secret is stored."},"license":{"value":null,"reason":"Licence record pending."},"files_and_references":{"bytes":{"value":null,"reason":"No product acquired."},"sha256":{"value":null,"reason":"No product bytes acquired."},"label":{"value":null,"reason":"No label acquired."},"kernel":{"value":null,"reason":"Kernel inventory pending."},"calibration":{"value":null,"reason":"Calibration reference pending."},"reference_version":{"value":null,"reason":"Reference selection pending."}},"coverage":{"solar_angle_difference_deg":{"value":null,"reason":"Geometry unverified."},"gsd_ratio":{"value":null,"reason":"Pair unselected."},"relief":{"value":null,"reason":"Terrain unselected."},"overlap_fraction":{"value":null,"reason":"Footprints unavailable."}},"status":"external_evidence_pending"},
    {"route_id":"c2-iirs","mission":"Chandrayaan-2","payload_family":"IIRS","product_id":{"value":null,"reason":"Official product selection pending."},"source_url":{"value":null,"reason":"Verified source record pending."},"access":{"value":null,"reason":"Access conditions pending."},"credentials":{"value":null,"reason":"Credential requirement is unknown; no secret is stored."},"license":{"value":null,"reason":"Licence record pending."},"files_and_references":{"bytes":{"value":null,"reason":"No product acquired."},"sha256":{"value":null,"reason":"No product bytes acquired."},"label":{"value":null,"reason":"No label acquired."},"kernel":{"value":null,"reason":"Kernel inventory pending."},"calibration":{"value":null,"reason":"Calibration reference pending."},"reference_version":{"value":null,"reason":"Reference selection pending."}},"coverage":{"solar_angle_difference_deg":{"value":null,"reason":"Geometry unverified."},"gsd_ratio":{"value":null,"reason":"Pair unselected."},"relief":{"value":null,"reason":"Terrain unselected."},"overlap_fraction":{"value":null,"reason":"Footprints unavailable."}},"status":"external_evidence_pending"},
    {"route_id":"lro-nac","mission":"LRO","payload_family":"LROC_NAC","product_id":{"value":null,"reason":"Reference product selection pending."},"source_url":{"value":null,"reason":"Verified source record pending."},"access":{"value":null,"reason":"Access conditions pending."},"credentials":{"value":null,"reason":"Credential requirement is unknown; no secret is stored."},"license":{"value":null,"reason":"Licence record pending."},"files_and_references":{"bytes":{"value":null,"reason":"No product acquired."},"sha256":{"value":null,"reason":"No product bytes acquired."},"label":{"value":null,"reason":"No label acquired."},"kernel":{"value":null,"reason":"Kernel inventory pending."},"calibration":{"value":null,"reason":"Calibration reference pending."},"reference_version":{"value":null,"reason":"Reference selection pending."}},"coverage":{"solar_angle_difference_deg":{"value":null,"reason":"Geometry unverified."},"gsd_ratio":{"value":null,"reason":"Pair unselected."},"relief":{"value":null,"reason":"Terrain unselected."},"overlap_fraction":{"value":null,"reason":"Footprints unavailable."}},"status":"external_evidence_pending"},
    {"route_id":"selene-tc","mission":"SELENE","payload_family":"SELENE_TC","product_id":{"value":null,"reason":"Reference product selection pending."},"source_url":{"value":null,"reason":"Verified source record pending."},"access":{"value":null,"reason":"Access conditions pending."},"credentials":{"value":null,"reason":"Credential requirement is unknown; no secret is stored."},"license":{"value":null,"reason":"Licence record pending."},"files_and_references":{"bytes":{"value":null,"reason":"No product acquired."},"sha256":{"value":null,"reason":"No product bytes acquired."},"label":{"value":null,"reason":"No label acquired."},"kernel":{"value":null,"reason":"Kernel inventory pending."},"calibration":{"value":null,"reason":"Calibration reference pending."},"reference_version":{"value":null,"reason":"Reference selection pending."}},"coverage":{"solar_angle_difference_deg":{"value":null,"reason":"Geometry unverified."},"gsd_ratio":{"value":null,"reason":"Pair unselected."},"relief":{"value":null,"reason":"Terrain unselected."},"overlap_fraction":{"value":null,"reason":"Footprints unavailable."}},"status":"external_evidence_pending"},
    {"route_id":"terrain-sldem","mission":"Lunar global","payload_family":"SLDEM","product_id":{"value":null,"reason":"Terrain product selection pending."},"source_url":{"value":null,"reason":"Verified source record pending."},"access":{"value":null,"reason":"Access conditions pending."},"credentials":{"value":null,"reason":"Credential requirement is unknown; no secret is stored."},"license":{"value":null,"reason":"Licence record pending."},"files_and_references":{"bytes":{"value":null,"reason":"No product acquired."},"sha256":{"value":null,"reason":"No product bytes acquired."},"label":{"value":null,"reason":"No label acquired."},"kernel":{"value":null,"reason":"Route unselected."},"calibration":{"value":null,"reason":"Route unselected."},"reference_version":{"value":null,"reason":"Version pending."}},"coverage":{"solar_angle_difference_deg":{"value":null,"reason":"No image pair."},"gsd_ratio":{"value":null,"reason":"Pair unselected."},"relief":{"value":null,"reason":"Terrain statistics not computed."},"overlap_fraction":{"value":null,"reason":"Footprints unavailable."}},"status":"external_evidence_pending"},
    {"route_id":"terrain-lola","mission":"LRO","payload_family":"LOLA","product_id":{"value":null,"reason":"Terrain product selection pending."},"source_url":{"value":null,"reason":"Verified source record pending."},"access":{"value":null,"reason":"Access conditions pending."},"credentials":{"value":null,"reason":"Credential requirement is unknown; no secret is stored."},"license":{"value":null,"reason":"Licence record pending."},"files_and_references":{"bytes":{"value":null,"reason":"No product acquired."},"sha256":{"value":null,"reason":"No product bytes acquired."},"label":{"value":null,"reason":"No label acquired."},"kernel":{"value":null,"reason":"Route unselected."},"calibration":{"value":null,"reason":"Route unselected."},"reference_version":{"value":null,"reason":"Version pending."}},"coverage":{"solar_angle_difference_deg":{"value":null,"reason":"No image pair."},"gsd_ratio":{"value":null,"reason":"Pair unselected."},"relief":{"value":null,"reason":"Terrain statistics not computed."},"overlap_fraction":{"value":null,"reason":"Footprints unavailable."}},"status":"external_evidence_pending"},
    {"route_id":"terrain-regional-nac-dtm","mission":"LRO","payload_family":"REGIONAL_NAC_DTM","product_id":{"value":null,"reason":"Terrain product selection pending."},"source_url":{"value":null,"reason":"Verified source record pending."},"access":{"value":null,"reason":"Access conditions pending."},"credentials":{"value":null,"reason":"Credential requirement is unknown; no secret is stored."},"license":{"value":null,"reason":"Licence record pending."},"files_and_references":{"bytes":{"value":null,"reason":"No product acquired."},"sha256":{"value":null,"reason":"No product bytes acquired."},"label":{"value":null,"reason":"No label acquired."},"kernel":{"value":null,"reason":"Route unselected."},"calibration":{"value":null,"reason":"Route unselected."},"reference_version":{"value":null,"reason":"Version pending."}},"coverage":{"solar_angle_difference_deg":{"value":null,"reason":"No image pair."},"gsd_ratio":{"value":null,"reason":"Pair unselected."},"relief":{"value":null,"reason":"Terrain statistics not computed."},"overlap_fraction":{"value":null,"reason":"Footprints unavailable."}},"status":"external_evidence_pending"}
  ]
}
